<?xml version="1.0" encoding="UTF-8"?>
<parameters xmlns:xsi="http://www.w3.org/2001/XMLSchema-instance"
            xsi:noNamespaceSchemaLocation="parameters.xsd">

    <!-- Output Parameters -->
    <outputParameters>
        <baseName>out</baseName>
        <writeFrequency>100</writeFrequency>
    </outputParameters>


    <!-- Simulation Parameters -->
    <simulationParameters>
        <tEnd>500</tEnd>
        <deltaT>0.01</deltaT>
        <cutOffRadius>4.0</cutOffRadius>
        <cellSize>1.8</cellSize>
        <gravityFactor>-0.001</gravityFactor>
        <forceType>LJ</forceType>
        <parallelizationVersion>
            <first_method>
            </first_method>
        </parallelizationVersion>
        <boundaryConditions>
            <boundaryConditionsPositiveZ>periodic</boundaryConditionsPositiveZ>
            <boundaryConditionsNegativeZ>periodic</boundaryConditionsNegativeZ>
            <boundaryConditionsPositiveX>periodic</boundaryConditionsPositiveX>
            <boundaryConditionsNegativeX>periodic</boundaryConditionsNegativeX>
            <boundaryConditionsPositiveY>reflective</boundaryConditionsPositiveY>
            <boundaryConditionsNegativeY>reflective</boundaryConditionsNegativeY>
        </boundaryConditions>
        <domainDimensions>
            <x>148</x>
            <y>148</y>
            <z>148</z>
        </domainDimensions>
    </simulationParameters>

    <!-- Membranes -->
    <membranes>
        <averageBondLength>2.2</averageBondLength>
        <forceParameter>300</forceParameter>
        <position>
            <x>15</x>
            <y>15</y>
            <z>15</z>
        </position>
        <velocity>
            <x>0</x>
            <y>0</y>
            <z>0</z>
        </velocity>
        <dimensions>
            <x>50</x>
            <y>50</y>
            <z>1</z>
        </dimensions>
        <mass>1.0</mass>
        <meshWidth>2.2</meshWidth>
        <sigma>1.0</sigma>
        <epsilon>1.0</epsilon>
    </membranes>


</parameters>